{
  "$schema": "http://json-schema.org/draft-07/schema#",
  "title": "requirements.schema",
  "description": "DISCOVER 态产出:课程需求定义,由 /course-discover 生成",
  "type": "object",
  "required": ["target_capability", "current_level", "daily_hours", "depth_goal", "acceptance_criteria", "research_grounded", "learner_persona", "topic_type"],
  "properties": {
    "target_capability": {
      "type": "string",
      "description": "终点能力,一句话,可验证(如'用 HuggingFace LoRA 微调一个文本分类模型')",
      "minLength": 10
    },
    "current_level": {
      "type": "object",
      "description": "学员当前水平(起点),二维拆分:主题深度 vs 工具熟练度",
      "required": ["topic_depth", "tool_fluency"],
      "properties": {
        "topic_depth": { "type": "string", "description": "对本主题的知识深度(如'零基础'/'了解概念'/'能写简单代码')" },
        "tool_fluency": { "type": "string", "description": "对相关工具的熟练度(如'不会用 VS Code'/'熟悉终端')" }
      },
      "additionalProperties": false
    },
    "daily_hours": {
      "type": "number",
      "description": "每日可用学习时长(小时)",
      "minimum": 0.5,
      "maximum": 24
    },
    "depth_goal": {
      "type": "string",
      "enum": ["了解", "能写", "能教", "能优化"],
      "description": "深度目标:决定 DAG 每个节点的最低要求标注和剪枝边界"
    },
    "learner_persona": {
      "type": "object",
      "description": "学员画像:谁在学习这个主题",
      "required": ["age_stage", "background", "motivation"],
      "properties": {
        "age_stage": { "type": "string", "description": "中学生/大学生/在职/转行" },
        "background": { "type": "string", "description": "已具备的知识和经验" },
        "motivation": { "type": "string", "description": "学习动机:兴趣/工作/考试/做项目" }
      },
      "additionalProperties": false
    },
    "topic_type": {
      "type": "string",
      "enum": ["独立主题", "路径第N步"],
      "description": "独立主题=从零开始;路径第N步=多课程路径的第N个(影响current_level写法)"
    },
    "acceptance_criteria": {
      "type": "array",
      "description": "验收标准列表(>=3 条),覆盖>=2 个认知层级(记忆理解/应用/分析评价),每项用'给定 X, 能产出 Y'格式",
      "items": { "type": "string", "minLength": 10 },
      "minItems": 3
    },
    "constraints": {
      "type": "array",
      "description": "限制条件(时间/语言/工具偏好)",
      "items": { "type": "string" }
    },
    "research_grounded": {
      "type": "boolean",
      "description": "研究加持是否成功。false = web_search 不可用,降级为纯 LLM 推理"
    },
    "reference_courses": {
      "type": "array",
      "description": "DISCOVER 态找到的参照课程列表(用于 PLAN 态 gold-set)",
      "items": {
        "type": "object",
        "required": ["name", "source"],
        "properties": {
          "name": { "type": "string" },
          "source": { "type": "string", "description": "URL 或出处" },
          "syllabus_extracted": { "type": "boolean" }
        }
      }
    },
    "reference_resources": {
      "type": "array",
      "description": "参考资料(博客/视频/awesome-list 等非结构化资源)",
      "items": {
        "type": "object",
        "required": ["name", "source", "type"],
        "properties": {
          "name": { "type": "string" },
          "source": { "type": "string" },
          "type": { "type": "string", "enum": ["blog", "video", "awesome_list", "docs"], "description": "资源类型" }
        }
      }
    },
    "success_scenarios": {
      "type": "array",
      "description": "学完后的真实使用场景(3-5 个),描述学员会自然做什么",
      "items": { "type": "string", "minLength": 10 },
      "minItems": 3
    },
    "scope_out_of_v1": {
      "type": "array",
      "description": "明确不在 v1 范围的能力(从 target_capability 收敛后剩下的)",
      "items": { "type": "string" }
    },
    "parallelism": {
      "type": "object",
      "description": "并发度配置:用户选择的 subagent 并行数",
      "required": ["build_parallelism", "qa_parallelism"],
      "properties": {
        "build_parallelism": {
          "type": "integer",
          "minimum": 1,
          "maximum": 10,
          "description": "BUILD 阶段并发 subagent 数"
        },
        "qa_parallelism": {
          "type": "integer",
          "minimum": 1,
          "maximum": 5,
          "description": "QA 阶段并发 subagent 数"
        }
      },
      "additionalProperties": false
    }
  },
  "additionalProperties": false
}
