{
  "target_capability": "能用 Git 完成日常工作中的版本控制:初始化仓库、提交更改、分支管理、处理合并冲突、与 GitHub 协作(push/pull/PR)",
  "scope_out_of_v1": [
    "Git 内部原理(object model / SHA-1 / refs)",
    "高级操作(rebase / cherry-pick / bisect)",
    "Git 工作流(Git Flow / GitHub Flow / Trunk-Based)",
    "多仓库管理(submodule / monorepo)",
    "CI/CD 集成(GitHub Actions / GitLab CI)"
  ],
  "learner_persona": {
    "age_stage": "在职开发者",
    "background": "3 年以上 Python/JS 经验,熟悉终端操作。工作中用过 Git(会 add/commit/push),但靠复制粘贴命令,不理解为什么。遇到合并冲突就慌,从不用分支。没用过 GitHub PR。",
    "motivation": "工作:团队协作需要规范的 Git 流程,之前总是搞砸。个人:想真正理解 Git 而不是死记命令。"
  },
  "topic_type": "独立主题",
  "current_level": {
    "topic_depth": "会用基础命令(add/commit/push/pull),但不懂原理。不会处理合并冲突,不用分支。没做过 PR。",
    "tool_fluency": "熟悉终端,会装 brew/apt。但没深入配置过 Git(SSH key/全局配置)。"
  },
  "daily_hours": 1.5,
  "depth_goal": "能写",
  "acceptance_criteria": [
    "理解层:能用'时间线存档'类比向新手解释 Git(每次 commit 是一个存档点,分支是平行时间线),并预测'在分支上 commit 但没 merge 会发生什么'",
    "应用层:给定一个工作场景(如'修复一个 bug'),能独立完成:创建分支 → 修改 → commit → push → 创建 PR → merge",
    "分析层:给定一个合并冲突的 Git 输出,能诊断冲突原因并解决(手动编辑冲突标记 → add → commit)"
  ],
  "success_scenarios": [
    "遇到需要修改代码时,会先 git checkout -b feature/xxx 创建分支",
    "提交前会 git diff 查看改动,写清晰的 commit message",
    "遇到合并冲突时不再慌,能手动解决冲突",
    "能独立完成 GitHub PR 流程(push → create PR → merge)"
  ],
  "constraints": [
    "运行环境 = macOS/Linux 终端 + Git 2.30+",
    "只教 CLI 版本,不涉及 GUI 工具(GitKraken/Sourcetree)",
    "每天 1.5 小时,约 4-5 天完成",
    "中文讲解,英文术语保留原文"
  ],
  "research_grounded": true,
  "reference_courses": [
    {
      "name": "Pro Git 官方书籍(免费)",
      "source": "https://git-scm.com/book/en/v2",
      "syllabus_extracted": true
    },
    {
      "name": "GitHub Git Cheat Sheet",
      "source": "https://education.github.com/git-cheat-sheet-education.pdf",
      "syllabus_extracted": false
    }
  ],
  "reference_resources": [
    {
      "name": "Learn Git Branching(交互式教程)",
      "source": "https://learngitbranching.js.org/",
      "type": "docs"
    },
    {
      "name": "Oh My Git!(游戏化学习)",
      "source": "https://ohmygit.org/",
      "type": "docs"
    }
  ]
}
