{
  "target_capability": "能设计 RESTful API:资源命名、HTTP 方法选择、状态码使用、版本控制、错误处理,并理解认证基础(JWT/OAuth2)",
  "scope_out_of_v1": [
    "GraphQL 设计与实现",
    "gRPC 与 Protocol Buffers",
    "API 网关与微服务架构",
    "WebSocket 实时通信",
    "OpenAPI/Swagger 规范深入"
  ],
  "learner_persona": {
    "age_stage": "在职开发者",
    "background": "3 年以上 Python/JS 经验,用过别人写的 API(发请求),但没设计过 API。不知道 PUT 和 PATCH 的区别,不懂为什么要用 409 Conflict。",
    "motivation": "工作:需要为前端团队设计后端 API,没经验不知道从哪开始。个人:想理解'好的 API 长什么样',看别人的 API 文档总是很舒服但自己做就乱。"
  },
  "topic_type": "独立主题",
  "current_level": {
    "topic_depth": "会用 fetch/axios 调用 API,但没设计过。知道 GET/POST,但不知道 PUT/PATCH/DELETE 的使用场景。没听过 HATEOAS。",
    "tool_fluency": "熟悉 JSON,用过 Postman 测试 API。但没用过 OpenAPI 规范。"
  },
  "daily_hours": 1.5,
  "depth_goal": "能写",
  "acceptance_criteria": [
    "理解层:能用'餐厅点餐'类比向新手解释 REST(资源 = 菜品,HTTP 方法 = 操作类型,状态码 = 服务员回应),并预测'用 POST 更新资源'会导致什么问题(幂等性)",
    "应用层:给定一个博客系统的需求(文章/评论/用户),能设计 API 端点(URL + 方法 + 请求/响应格式)",
    "分析层:给定一个设计糟糕的 API(如用 GET 删除资源、状态码全返回 200),能识别至少 3 个问题并修正"
  ],
  "success_scenarios": [
    "设计 API 时,先画资源图再命名端点",
    "选择 HTTP 方法时,会考虑幂等性(GET/PUT 幂等,POST 不幂等)",
    "返回错误时,会用正确的状态码(400/404/500)而不是全 200"
  ],
  "constraints": [
    "不涉及具体框架(Flask/FastAPI/Express),只教设计原则",
    "运行环境 = 纸笔/Markdown 即可,不需要写代码",
    "每天 1.5 小时,约 4-5 天完成"
  ],
  "research_grounded": true,
  "reference_courses": [
    {
      "name": "REST API Tutorial(restfulapi.net)",
      "source": "https://restfulapi.net/",
      "syllabus_extracted": true
    },
    {
      "name": "Microsoft REST API Guidelines",
      "source": "https://github.com/microsoft/api-guidelines",
      "syllabus_extracted": false
    }
  ],
  "reference_resources": [
    {
      "name": "Google API Design Guide",
      "source": "https://cloud.google.com/apis/design",
      "type": "docs"
    }
  ]
}
