{
  "target_capability": "能独立用 SQL 查询关系型数据库:多表 JOIN、聚合函数(GROUP BY/HAVING)、子查询,并理解查询执行计划基础",
  "scope_out_of_v1": [
    "数据库索引优化(B+树/执行计划深入分析)",
    "事务与锁(ACID/隔离级别/死锁)",
    "NoSQL 对比(MongoDB/Redis)",
    "ORM 原理(SQLAlchemy/Prisma 内部机制)"
  ],
  "learner_persona": {
    "age_stage": "在职开发者",
    "background": "3 年以上 Python/JS 经验,用 ORM(Sequelize/SQLAlchemy) 操作数据库,但没写过原生 SQL。遇到复杂查询就傻眼,不知道怎么优化慢查询。",
    "motivation": "工作:需要写复杂报表查询,ORM 不够用。个人:想理解数据库底层,面试要考 SQL。"
  },
  "topic_type": "独立主题",
  "current_level": {
    "topic_depth": "会用 ORM 做 CRUD,但没写过 SELECT ... JOIN。知道 WHERE 但不知道 HAVING。没听过执行计划。",
    "tool_fluency": "熟悉终端,装过 MySQL/PostgreSQL 但很少直接用。用过 DBeaver 可视化工具。"
  },
  "daily_hours": 2,
  "depth_goal": "能写",
  "acceptance_criteria": [
    "理解层:能用'Excel 筛选+透视表'类比向新手解释 SQL(WHERE = 筛选,GROUP BY = 透视,JOIN = VLOOKUP),并预测 LEFT JOIN 和 INNER JOIN 的结果差异",
    "应用层:给定一个电商数据库(用户/订单/商品三表),能写 SQL 查询'每个用户的总消费金额 Top 10'",
    "分析层:给定一个慢查询日志和全表扫描警告,能诊断问题(缺索引)并给出优化方案(CREATE INDEX)"
  ],
  "success_scenarios": [
    "遇到'多表关联查询'时,会画 ER 图理清关系再写 JOIN",
    "写 GROUP BY 时,知道 WHERE 和 HAVING 的区别(WHERE 过滤行,HAVING 过滤分组)",
    "遇到慢查询时,会 EXPLAIN 看执行计划而不是瞎加索引"
  ],
  "constraints": [
    "运行环境 = PostgreSQL 14+ 或 MySQL 8+(推荐 PostgreSQL)",
    "只教标准 SQL,不深入特定数据库的扩展",
    "每天 2 小时,约 5-6 天完成"
  ],
  "research_grounded": true,
  "reference_courses": [
    {
      "name": "PostgreSQL 官方教程",
      "source": "https://www.postgresql.org/docs/current/tutorial.html",
      "syllabus_extracted": true
    },
    {
      "name": "SQLBolt(交互式教程)",
      "source": "https://sqlbolt.com/",
      "syllabus_extracted": true
    }
  ],
  "reference_resources": [
    {
      "name": "Use The Index, Luke!(SQL 性能指南)",
      "source": "https://use-the-index-luke.com/",
      "type": "docs"
    }
  ]
}
