{
  "target_capability": "能运用 TDD(测试驱动开发)三步循环(红-绿-重构)编写代码:先写失败测试、写最少代码通过测试、重构优化,并理解何时用 TDD 何时不用",
  "scope_out_of_v1": [
    "BDD(行为驱动开发)与 Gherkin 语法",
    "测试金字塔与测试覆盖率深入",
    "Mock/Stub/Fake 高级用法",
    "CI/CD 中的自动化测试集成",
    "变异测试(Mutation Testing)"
  ],
  "learner_persona": {
    "age_stage": "在职开发者",
    "background": "3 年以上 Python/JS 经验,写代码很快但 bug 也很多。听说过 TDD 但觉得'写测试太慢',没系统实践过。偶尔写测试也是写完代码后补的。",
    "motivation": "工作:团队要求写单元测试,但不知道从哪开始。个人:听说 TDD 能提升代码质量,想真正理解而不是死记步骤。"
  },
  "topic_type": "独立主题",
  "current_level": {
    "topic_depth": "听说过 TDD 三步循环(红-绿-重构),但没实践过。写测试 = 写完代码后补 assert。不了解 pytest/Jest 的 fixture/mock。",
    "tool_fluency": "熟悉终端,会用 pip/npm 装库。但没用过 pytest/unittest。"
  },
  "daily_hours": 1.5,
  "depth_goal": "能写",
  "acceptance_criteria": [
    "理解层:能用'先写考试再教学生'类比向新手解释 TDD(先定验收标准 → 教最少内容通过验收 → 优化教学方法),并预测'先写代码再写测试'会失去什么好处(设计反馈)",
    "应用层:给定一个简单需求(如'实现一个计算器'),能用 TDD 三步循环产出代码和测试(先写 test_add 失败 → 写 add 通过 → 重构)",
    "分析层:给定一段'伪 TDD'代码(测试是代码的镜像,没有真正驱动设计),能识别问题并给出改进方案"
  ],
  "success_scenarios": [
    "接到需求时,先想'怎么测试这个功能'再写代码",
    "写测试时,只测试行为(输入→输出)而不是实现细节",
    "遇到'不好测试'的代码,知道这是设计信号(需要拆分函数)"
  ],
  "constraints": [
    "运行环境 = Python(pytest)或 JS(Jest),学员自选",
    "只教 TDD 基础循环,不深入 BDD/变异测试",
    "每天 1.5 小时,约 3-4 天完成"
  ],
  "research_grounded": true,
  "reference_courses": [
    {
      "name": "pytest 官方教程",
      "source": "https://docs.pytest.org/en/stable/getting_started.html",
      "syllabus_extracted": true
    },
    {
      "name": "Kent Beck: Test-Driven Development by Example",
      "source": "https://www.oreilly.com/library/view/test-driven-development/0321146550/",
      "syllabus_extracted": false
    }
  ],
  "reference_resources": [
    {
      "name": "TDD Katas(练习集)",
      "source": "https://github.com/garora/TDD-Katas",
      "type": "docs"
    }
  ]
}
