{
  "target_capability": "能独立使用 let/const/var 声明变量,理解作用域差异,并根据场景选择正确的声明方式编写可运行 JS 代码",
  "scope_out_of_v1": [
    "理解 TDZ(暂时性死区)的底层机制",
    "使用解构赋值/展开运算符简化变量声明",
    "在 Node.js 项目中使用模块系统(import/export)管理变量"
  ],
  "learner_persona": {
    "age_stage": "在职开发者",
    "background": "3 年以上 Python 经验,熟悉基本编程概念(变量/函数/循环)。用过 ChatGPT 辅助写代码,但未系统学过 JavaScript。日常用 VS Code,熟悉终端基本操作。",
    "motivation": "工作:公司新项目用 Node.js,需要快速上手 JS 基础;个人:想理解'为什么 JS 的 var 和 let 行为不一样'这种困惑"
  },
  "topic_type": "独立主题",
  "current_level": {
    "topic_depth": "零基础 JS —— 了解'变量是容器'类比,但未写过任何 JS 代码。不了解作用域/hoisting/const 与 let 的区别。",
    "tool_fluency": "熟悉 VS Code 和终端,但没在 JS 项目中实操过。知道 node -v 能看版本,但没用过 npm。"
  },
  "daily_hours": 1.5,
  "depth_goal": "能写",
  "acceptance_criteria": [
    "理解层:能用'贴标签盒子'类比向没学过编程的人解释 let/const/var 三者的区别,并预测 var 在 if 块里声明会被 hoisting 到函数级",
    "应用层:给定一个场景描述(如'需要在循环中累加计数'),能正确选择 let/var/const 之一并写出声明语句",
    "分析层:给定一段含变量的 JS 代码,能准确预测其输出结果(含作用域和 hoisting 行为),并解释为什么"
  ],
  "success_scenarios": [
    "遇到'需要累加计数'的场景,会选 let 而不是 const",
    "看到 const arr = []; arr.push(1) 不会惊讶,知道 const 不是完全冻结",
    "写 for 循环时用 let 声明循环变量,知道为什么不用 var",
    "看到旧代码里的 var,能识别是否有 hoisting 风险并建议改成 let"
  ],
  "constraints": [
    "运行环境 = 浏览器控制台(推荐,零配置)或 Node.js(需先安装)",
    "纯 JavaScript 语法,不涉及 DOM/浏览器 API",
    "每天 1.5 小时,约 3-4 天完成",
    "中文讲解,英文术语保留原文"
  ],
  "research_grounded": true,
  "reference_courses": [
    {
      "name": "MDN: JavaScript First Steps — Variables",
      "source": "https://developer.mozilla.org/en-US/docs/Learn/JavaScript/First_steps/Variables",
      "syllabus_extracted": true
    },
    {
      "name": "javascript.info: Variables",
      "source": "https://javascript.info/variables",
      "syllabus_extracted": true
    }
  ],
  "reference_resources": [
    {
      "name": "freeCodeCamp: JavaScript Algorithms and Data Structures",
      "source": "https://www.freecodecamp.org/learn/javascript-algorithms-and-data-structures/",
      "type": "docs"
    }
  ]
}
