{
  "target_capability": "能独立编写 Python 爬虫,从公开网站抓取结构化数据(产品列表/价格/评论),处理常见反爬机制(429/封 IP),并将数据存为 CSV",
  "scope_out_of_v1": [
    "使用 Scrapy 框架构建大型爬虫项目",
    "处理 JavaScript 渲染页面(Selenium/Playwright)",
    "构建分布式爬虫(多机协作)",
    "反反爬高级技术(验证码识别/代理池)"
  ],
  "learner_persona": {
    "age_stage": "在职开发者",
    "background": "3 年以上 Python 经验,熟悉 requests 和 BeautifulSoup。写过简单脚本,但没系统写过爬虫。了解 HTTP 基础(GET/POST/headers),但不了解反爬机制。",
    "motivation": "工作:需要从公开网站抓取竞品价格数据,手动复制太慢。个人:想学爬虫技术,听说很简单但自己写总是被封。"
  },
  "topic_type": "独立主题",
  "current_level": {
    "topic_depth": "零基础爬虫 —— 写过 requests.get() 获取网页,但没解析过 HTML。不知道什么是反爬,为什么会被封。",
    "tool_fluency": "熟悉 pip 安装库,熟悉 VS Code 和终端。但没用过虚拟环境(venv),没用过 Scrapy。"
  },
  "daily_hours": 2,
  "depth_goal": "能写",
  "acceptance_criteria": [
    "理解层:能用'快递站'类比向新手解释爬虫(发送请求→接收响应→解析内容→存储数据),并预测'请求过快'会导致什么(429/封 IP)",
    "应用层:给定一个产品列表页 URL,能用 requests + BeautifulSoup 抓取产品名称和价格,存为 CSV",
    "分析层:给定一个被反爬的网页(返回 429 或空白),能诊断原因并给出至少 2 种解决方案(加 headers/加延时/用代理)"
  ],
  "success_scenarios": [
    "遇到'需要抓取 N 个页面的数据'时,会先检查 robots.txt 再加延时",
    "收到 429 响应时,会加 User-Agent 和 time.sleep() 而不是疯狂重试",
    "抓取完成后会用 pandas 存 CSV 而不是手动复制",
    "遇到反爬升级时,知道何时该用 Selenium/Scrapy 而不是硬刚"
  ],
  "constraints": [
    "运行环境 = Python 3.10+ + venv(推荐)",
    "只抓公开数据,遵守 robots.txt",
    "每天 2 小时,约 5-7 天完成",
    "中文讲解,英文术语保留原文"
  ],
  "research_grounded": true,
  "reference_courses": [
    {
      "name": "BeautifulSoup 官方文档",
      "source": "https://beautiful-soup-4.readthedocs.io/",
      "syllabus_extracted": true
    },
    {
      "name": "Scrapy 官方教程",
      "source": "https://docs.scrapy.org/en/latest/intro/tutorial.html",
      "syllabus_extracted": false
    }
  ],
  "reference_resources": [
    {
      "name": "Real Python: Web Scraping with BeautifulSoup",
      "source": "https://realpython.com/beautiful-soup-web-scraper-python/",
      "type": "blog"
    },
    {
      "name": "Scrapy vs BeautifulSoup: When to Use Which",
      "source": "https://www.scrapingbee.com/blog/scrapy-vs-beautifulsoup/",
      "type": "blog"
    }
  ]
}
