{
  "target_capability": "能独立使用正则表达式进行文本搜索(findall)、替换(sub)和验证(fullmatch),处理邮箱/手机号/URL 等常见模式",
  "scope_out_of_v1": [
    "正则表达式引擎原理(NFA/DFA)",
    "性能优化(回溯/灾难性回溯)",
    "多语言正则差异(PCRE/Python/JS)"
  ],
  "learner_persona": {
    "age_stage": "在职开发者",
    "background": "3 年以上 Python/JS 经验,处理文本数据时用 str.replace() 硬编码,遇到复杂模式就懵。听说过正则但觉得语法难记。",
    "motivation": "工作:需要从日志中提取特定格式的数据,手动处理太慢。个人:想学会正则这个'万能工具'。"
  },
  "topic_type": "独立主题",
  "current_level": {
    "topic_depth": "零基础正则 —— 知道 . * + ? 的含义,但不会组合使用。没用过 re 模块。",
    "tool_fluency": "熟悉 Python,熟悉终端。但没用过 regex101.com 等工具。"
  },
  "daily_hours": 1.5,
  "depth_goal": "能写",
  "acceptance_criteria": [
    "理解层:能用'通配符搜索'类比向新手解释正则(就像文件搜索的 *.txt,但更强大),并预测 'a+' 匹配 'aaa' 会返回什么",
    "应用层:给定一个邮箱地址列表,能用 re.findall() 提取所有有效邮箱",
    "分析层:给定一个错误的正则表达式(如 r'<.*>' 匹配 HTML),能诊断问题(贪婪匹配)并修正(如 r'<[^>]*>')"
  ],
  "success_scenarios": [
    "遇到'从文本提取所有手机号'时,会写 r'1[3-9]\\d{9}' 而不是手动查找",
    "遇到'替换所有空格为下划线'时,会写 re.sub(r'\\s+', '_', text)",
    "遇到'验证用户输入是否为邮箱'时,会写 re.fullmatch(pattern, input)"
  ],
  "constraints": [
    "运行环境 = Python 3.10+ + re 模块(标准库)",
    "只教基础语法,不深入引擎原理",
    "每天 1.5 小时,约 3-4 天完成"
  ],
  "research_grounded": true,
  "reference_courses": [
    {
      "name": "Python re 模块官方文档",
      "source": "https://docs.python.org/3/library/re.html",
      "syllabus_extracted": true
    },
    {
      "name": "RegexOne(交互式教程)",
      "source": "https://regexone.com/",
      "syllabus_extracted": true
    }
  ],
  "reference_resources": [
    {
      "name": "regex101.com(在线测试工具)",
      "source": "https://regex101.com/",
      "type": "docs"
    }
  ]
}
